{
  "repositoryId": 504152566,
  "fullName": "gdcc/easyDataverse",
  "exclude": true,
  "curationStatus": "reviewed",
  "maintainerNotes": "False positive (Category A): Python library for interacting with academic Dataverse installations, maintained by Global Dataverse Community Consortium (gdcc). No Microsoft connection."
}
