{
  "repositoryId": 16373462,
  "fullName": "inoerp/inoERP",
  "exclude": true,
  "curationStatus": "reviewed",
  "maintainerNotes": "False positive: Competing open-source ERP (Go + Flutter, modeled after Oracle R12 and SAP). Uses 'dynamics-365' topic for SEO comparison only. Zero Microsoft/Power Platform connection. Previously flagged HIGH confidence in May 2026 initial review but not actioned due to miscategorization with D365 F&O group."
}
