{
  "repositoryId": 168520935,
  "fullName": "valerymoskalenko/D365FFO-PowerShell-scripts",
  "exclude": true,
  "curationStatus": "reviewed",
  "maintainerNotes": "False positive (Category D): PowerShell maintenance scripts for D365 Finance & Operations environments. Not part of the Power Platform ecosystem."
}
