{
  "repositoryId": 262569785,
  "fullName": "steedos/awesome-low-code",
  "exclude": true,
  "curationStatus": "reviewed",
  "maintainerNotes": "False positive: Generic 'awesome list' of low-code platforms (Chinese-language) that lists Microsoft Power Apps as one item among ~20 platforms including Salesforce, OutSystems, Mendix, SAP, Appian, etc. Uses 'power-apps' topic for SEO. Not a Power Platform tool or community resource."
}
