{
  "repositoryId": 40124804,
  "fullName": "IQSS/dataverse-client-r",
  "exclude": true,
  "curationStatus": "reviewed",
  "maintainerNotes": "False positive (Category A): Official R client for Harvard IQSS Dataverse. Org IQSS = Harvard's Institute for Quantitative Social Science. No relation to Microsoft Dataverse."
}
