{
  "repositoryId": 520916910,
  "fullName": "J535D165/datahugger",
  "exclude": true,
  "curationStatus": "reviewed",
  "maintainerNotes": "False positive (Category A): Python CLI for downloading scientific datasets from academic repositories (Zenodo, Harvard Dataverse, etc.). No Microsoft connection."
}
