{
  "repositoryId": 1096594702,
  "fullName": "cheeseburgertony/evoke",
  "exclude": true,
  "curationStatus": "reviewed",
  "maintainerNotes": "False positive (Category C): AI-powered web app generator using Next.js, OpenAI, and Anthropic APIs. Uses `ai-builder` in the generic sense. No Microsoft AI Builder connection."
}
