{
  "repositoryId": 2579069,
  "fullName": "datopian/portaljs",
  "exclude": true,
  "curationStatus": "reviewed",
  "maintainerNotes": "False positive (Category A): Next.js/CKAN open data portal framework. Uses `dataverse` topic because it connects to Harvard IQSS Dataverse academic repositories, not Microsoft Dataverse."
}
