{
  "repositoryId": 172687669,
  "fullName": "gdcc/pyDataverse",
  "exclude": true,
  "curationStatus": "reviewed",
  "maintainerNotes": "False positive (Category A): Official Python module for Harvard Dataverse maintained by the Global Dataverse Community Consortium (gdcc). No Microsoft connection."
}
