{
  "repositoryId": 115293197,
  "fullName": "AXbusiness/Dynamics365-MetaDataExplorer",
  "exclude": true,
  "curationStatus": "reviewed",
  "maintainerNotes": "False positive (Category D): Metadata explorer for D365 Finance & Operations (AX7/X++) application packages. Not part of the Power Platform ecosystem."
}
