{
  "repositoryId": 764723738,
  "fullName": "Skyvern-AI/skyvern",
  "exclude": true,
  "curationStatus": "reviewed",
  "maintainerNotes": "False positive (Category B): Python/Playwright/LLM browser automation tool — a direct competitor to Power Automate Desktop. Added `powerautomate` topic for SEO. No Microsoft technology."
}
